{
  "v": 1,
  "seed": 1404,
  "camera": {
    "model": "pinhole",
    "position_m": [
      0,
      0,
      0
    ],
    "look_at_m": [
      10000,
      0,
      0
    ],
    "up": [
      0,
      0,
      1
    ],
    "vfov_rad": 0.01
  },
  "environment": {
    "type": "constant",
    "luminance_cdm2": 1,
    "color": [
      1,
      1,
      1
    ]
  },
  "render": {
    "width_px": 128,
    "height_px": 128,
    "spp": 16,
    "max_bounces": 1,
    "sampler": "independent",
    "integrator": "pt_bsdf_p0",
    "display_white_cdm2": 1
  },
  "materials": {
    "m": {
      "base_color": [
        1,
        1,
        1
      ]
    }
  },
  "objects": {
    "ball": {
      "shape": "sphere",
      "center_m": [
        10000,
        0,
        0
      ],
      "radius_m": 2.5,
      "material": "m"
    }
  }
}
