{
  "v": 1,
  "seed": 606,
  "camera": {
    "model": "pinhole",
    "position_m": [
      0,
      -4,
      0
    ],
    "look_at_m": [
      0,
      0,
      0
    ],
    "up": [
      0,
      0,
      1
    ],
    "vfov_rad": 0.6
  },
  "environment": {
    "type": "constant",
    "luminance_cdm2": 0,
    "color": [
      1,
      1,
      1
    ]
  },
  "render": {
    "width_px": 64,
    "height_px": 64,
    "spp": 4,
    "max_bounces": 1,
    "sampler": "independent",
    "integrator": "pt_bsdf_p0",
    "display_white_cdm2": 1
  },
  "materials": {},
  "objects": {}
}
