{
  "v": 1,
  "seed": 1717,
  "physics": {
    "integrator": "xpbd_unconstrained_p0",
    "gravity_m_s2": [
      0,
      0,
      -9.81
    ],
    "dt_s": 0.015625,
    "steps": 128,
    "record_every_steps": 8
  },
  "materials": {
    "m": {
      "base_color": [
        0.5,
        0.5,
        0.5
      ]
    }
  },
  "objects": {
    "ball": {
      "shape": "sphere",
      "center_m": [
        0,
        0,
        0
      ],
      "radius_m": 1,
      "material": "m",
      "body": {
        "mass_kg": 1,
        "velocity_m_s": [
          0,
          0,
          0
        ]
      }
    }
  }
}
