{
  "v": 1,
  "seed": 101,
  "camera": {
    "model": "pinhole",
    "position_m": [
      0,
      -6,
      2.5
    ],
    "look_at_m": [
      0,
      0,
      0.8
    ],
    "up": [
      0,
      0,
      1
    ],
    "vfov_rad": 0.8
  },
  "environment": {
    "type": "constant",
    "luminance_cdm2": 0.5,
    "color": [
      1,
      1,
      1
    ]
  },
  "render": {
    "width_px": 128,
    "height_px": 96,
    "spp": 64,
    "max_bounces": 4,
    "sampler": "independent",
    "integrator": "pt_bsdf_p0",
    "display_white_cdm2": 2
  },
  "physics": {
    "integrator": "xpbd_unconstrained_p0",
    "gravity_m_s2": [
      0,
      0,
      -9.81
    ],
    "dt_s": 0.00390625,
    "steps": 256,
    "record_every_steps": 32
  },
  "materials": {
    "floor": {
      "base_color": [
        0.6,
        0.6,
        0.6
      ]
    },
    "red": {
      "base_color": [
        0.8,
        0.2,
        0.2
      ]
    },
    "green": {
      "base_color": [
        0.2,
        0.8,
        0.3
      ]
    },
    "blue": {
      "base_color": [
        0.2,
        0.3,
        0.9
      ]
    },
    "grey": {
      "base_color": [
        0.5,
        0.5,
        0.5
      ]
    },
    "white": {
      "base_color": [
        0.9,
        0.9,
        0.9
      ]
    },
    "lamp": {
      "base_color": [
        0.1,
        0.1,
        0.1
      ],
      "emissive_cdm2": 20,
      "emissive_color": [
        1,
        0.9,
        0.7
      ]
    }
  },
  "objects": {
    "floor": {
      "shape": "plane",
      "point_m": [
        0,
        0,
        0
      ],
      "normal": [
        0,
        0,
        1
      ],
      "material": "floor"
    },
    "ball_a": {
      "shape": "sphere",
      "center_m": [
        -1.5,
        0,
        0.6
      ],
      "radius_m": 0.6,
      "material": "red",
      "body": {
        "mass_kg": 1,
        "velocity_m_s": [
          0.5,
          0,
          2
        ]
      }
    },
    "ball_b": {
      "shape": "sphere",
      "center_m": [
        0,
        0.5,
        0.8
      ],
      "radius_m": 0.8,
      "material": "green"
    },
    "ball_c": {
      "shape": "sphere",
      "center_m": [
        1.6,
        -0.2,
        0.5
      ],
      "radius_m": 0.5,
      "material": "blue",
      "body": {
        "mass_kg": 2,
        "velocity_m_s": [
          -0.3,
          0.1,
          1
        ]
      }
    },
    "ball_d": {
      "shape": "sphere",
      "center_m": [
        0.6,
        -1.4,
        0.3
      ],
      "radius_m": 0.3,
      "material": "white"
    },
    "ball_e": {
      "shape": "sphere",
      "center_m": [
        -0.4,
        -1.2,
        0.25
      ],
      "radius_m": 0.25,
      "material": "grey",
      "body": {
        "mass_kg": 0.5,
        "velocity_m_s": [
          0,
          0,
          3
        ]
      }
    },
    "lamp": {
      "shape": "sphere",
      "center_m": [
        0.5,
        1.5,
        2.6
      ],
      "radius_m": 0.4,
      "material": "lamp"
    }
  }
}
